{"$schema":"https://json-schema.org/draft/2020-12/schema","$id":"stellar-release-manifest-v0.2.schema.json","additionalProperties":false,"properties":{"files":{"items":{"additionalProperties":false,"allOf":[{"if":{"properties":{"kind":{"enum":["service","broker","runner","compiler"]}}},"then":{"properties":{"authenticodePolicy":{"enum":["REQUIRE_VALID_EMBEDDED","UNSIGNED_REVIEW_ONLY"]},"imports":{"minItems":1},"nativeInspectionHash":{"pattern":"^sha256:[a-f0-9]{64}$","type":"string"},"signers":{"minItems":1}}},"else":{"properties":{"authenticodePolicy":{"type":"null"},"nativeInspectionHash":{"type":"null"}}}}],"properties":{"authenticodePolicy":{"enum":["REQUIRE_VALID_EMBEDDED","UNSIGNED_REVIEW_ONLY",null]},"bytes":{"maximum":2147483648,"minimum":1,"type":"integer"},"imports":{"items":{"maxLength":256,"minLength":1,"type":"string"},"maxItems":512,"type":"array","uniqueItems":true},"kind":{"enum":["service","broker","runner","compiler","stdlib","schema","canonical-policy","config","adapter","script","documentation","static-imports"]},"nativeInspectionHash":{"anyOf":[{"pattern":"^sha256:[a-f0-9]{64}$","type":"string"},{"type":"null"}]},"path":{"maxLength":512,"pattern":"^[A-Za-z0-9_.-]+(?:/[A-Za-z0-9_.-]+)*$","type":"string"},"sha256":{"pattern":"^sha256:[a-f0-9]{64}$","type":"string"},"signers":{"items":{"maxLength":256,"minLength":1,"type":"string"},"maxItems":32,"type":"array","uniqueItems":true}},"required":["path","kind","bytes","sha256","imports","signers","authenticodePolicy","nativeInspectionHash"],"type":"object"},"maxItems":256,"minItems":12,"type":"array"},"installable":{"type":"boolean"},"releaseId":{"maxLength":128,"minLength":1,"pattern":"^[A-Za-z0-9._-]+$","type":"string"},"schema":{"const":"stellar.t7d-release-manifest/v0.2"},"signer":{"additionalProperties":false,"properties":{"kid":{"pattern":"^sha256:[a-f0-9]{64}$","type":"string"},"purpose":{"const":"aegis-stellar-release"}},"required":["kid","purpose"],"type":"object"},"signingPolicy":{"enum":["LAB_SELF_SIGNED","EXTERNAL_SIGNER"]},"target":{"additionalProperties":false,"properties":{"abi":{"const":"stellar-win64-v0.1"},"arch":{"const":"x64"},"os":{"const":"windows"}},"required":["os","arch","abi"],"type":"object"}},"required":["schema","releaseId","installable","target","signingPolicy","signer","files"],"type":"object"}
