{"files":[{"authenticodePolicy":null,"bytes":9282,"imports":[],"kind":"adapter","nativeInspectionHash":null,"path":"adapter/service-contract-adapter.ts","sha256":"sha256:558014a5ababbc6c0864d699d810e14bf551f1cddc2bd375a9ad620a4ef1a06f","signers":[]},{"authenticodePolicy":"UNSIGNED_REVIEW_ONLY","bytes":654848,"imports":["ADVAPI32.DLL!CloseServiceHandle","ADVAPI32.DLL!ConvertSecurityDescriptorToStringSecurityDescriptorW","ADVAPI32.DLL!ConvertSidToStringSidW","ADVAPI32.DLL!ConvertStringSecurityDescriptorToSecurityDescriptorW","ADVAPI32.DLL!CreateWellKnownSid","ADVAPI32.DLL!EqualSid","ADVAPI32.DLL!GetAce","ADVAPI32.DLL!GetSecurityDescriptorDacl","ADVAPI32.DLL!GetSecurityDescriptorOwner","ADVAPI32.DLL!GetSecurityInfo","ADVAPI32.DLL!GetTokenInformation","ADVAPI32.DLL!ImpersonateNamedPipeClient","ADVAPI32.DLL!IsWellKnownSid","ADVAPI32.DLL!LookupAccountNameW","ADVAPI32.DLL!OpenProcessToken","ADVAPI32.DLL!OpenSCManagerW","ADVAPI32.DLL!OpenServiceW","ADVAPI32.DLL!OpenThreadToken","ADVAPI32.DLL!QueryServiceConfig2W","ADVAPI32.DLL!QueryServiceConfigW","ADVAPI32.DLL!QueryServiceObjectSecurity","ADVAPI32.DLL!QueryServiceStatusEx","ADVAPI32.DLL!RegisterServiceCtrlHandlerExW","ADVAPI32.DLL!RevertToSelf","ADVAPI32.DLL!SetServiceStatus","ADVAPI32.DLL!StartServiceCtrlDispatcherW","BCRYPT.DLL!BCryptCloseAlgorithmProvider","BCRYPT.DLL!BCryptCreateHash","BCRYPT.DLL!BCryptDestroyHash","BCRYPT.DLL!BCryptDestroyKey","BCRYPT.DLL!BCryptFinishHash","BCRYPT.DLL!BCryptGenRandom","BCRYPT.DLL!BCryptGetProperty","BCRYPT.DLL!BCryptHashData","BCRYPT.DLL!BCryptOpenAlgorithmProvider","BCRYPT.DLL!BCryptVerifySignature","CRYPT32.DLL!CertCloseStore","CRYPT32.DLL!CertFindCertificateInStore","CRYPT32.DLL!CertFreeCertificateContext","CRYPT32.DLL!CertGetCertificateContextProperty","CRYPT32.DLL!CryptBinaryToStringA","CRYPT32.DLL!CryptDecodeObjectEx","CRYPT32.DLL!CryptImportPublicKeyInfoEx2","CRYPT32.DLL!CryptMsgClose","CRYPT32.DLL!CryptMsgGetParam","CRYPT32.DLL!CryptQueryObject","KERNEL32.DLL!CancelIoEx","KERNEL32.DLL!CloseHandle","KERNEL32.DLL!CompareStringW","KERNEL32.DLL!ConnectNamedPipe","KERNEL32.DLL!CreateEventW","KERNEL32.DLL!CreateFileW","KERNEL32.DLL!CreateNamedPipeW","KERNEL32.DLL!DecodePointer","KERNEL32.DLL!DeleteCriticalSection","KERNEL32.DLL!DeleteFileW","KERNEL32.DLL!DisconnectNamedPipe","KERNEL32.DLL!EncodePointer","KERNEL32.DLL!EnterCriticalSection","KERNEL32.DLL!EnumSystemLocalesW","KERNEL32.DLL!ExitProcess","KERNEL32.DLL!FindClose","KERNEL32.DLL!FindFirstFileExW","KERNEL32.DLL!FindNextFileW","KERNEL32.DLL!FlsAlloc","KERNEL32.DLL!FlsFree","KERNEL32.DLL!FlsGetValue","KERNEL32.DLL!FlsSetValue","KERNEL32.DLL!FlushFileBuffers","KERNEL32.DLL!FreeEnvironmentStringsW","KERNEL32.DLL!FreeLibrary","KERNEL32.DLL!GetACP","KERNEL32.DLL!GetCPInfo","KERNEL32.DLL!GetCommandLineA","KERNEL32.DLL!GetCommandLineW","KERNEL32.DLL!GetConsoleMode","KERNEL32.DLL!GetConsoleOutputCP","KERNEL32.DLL!GetCurrentProcess","KERNEL32.DLL!GetCurrentProcessId","KERNEL32.DLL!GetCurrentThread","KERNEL32.DLL!GetCurrentThreadId","KERNEL32.DLL!GetEnvironmentStringsW","KERNEL32.DLL!GetFileAttributesW","KERNEL32.DLL!GetFileInformationByHandle","KERNEL32.DLL!GetFileInformationByHandleEx","KERNEL32.DLL!GetFileSizeEx","KERNEL32.DLL!GetFileType","KERNEL32.DLL!GetLastError","KERNEL32.DLL!GetLocaleInfoW","KERNEL32.DLL!GetModuleFileNameW","KERNEL32.DLL!GetModuleHandleExW","KERNEL32.DLL!GetModuleHandleW","KERNEL32.DLL!GetNamedPipeClientProcessId","KERNEL32.DLL!GetNamedPipeServerProcessId","KERNEL32.DLL!GetOEMCP","KERNEL32.DLL!GetOverlappedResult","KERNEL32.DLL!GetProcAddress","KERNEL32.DLL!GetProcessHeap","KERNEL32.DLL!GetProcessTimes","KERNEL32.DLL!GetStartupInfoW","KERNEL32.DLL!GetStdHandle","KERNEL32.DLL!GetStringTypeW","KERNEL32.DLL!GetSystemDirectoryW","KERNEL32.DLL!GetSystemTimeAsFileTime","KERNEL32.DLL!GetSystemTimePreciseAsFileTime","KERNEL32.DLL!GetTickCount","KERNEL32.DLL!GetTickCount64","KERNEL32.DLL!GetUserDefaultLCID","KERNEL32.DLL!GetVolumeInformationW","KERNEL32.DLL!GetVolumePathNameW","KERNEL32.DLL!HeapAlloc","KERNEL32.DLL!HeapFree","KERNEL32.DLL!HeapReAlloc","KERNEL32.DLL!HeapSize","KERNEL32.DLL!InitializeCriticalSectionEx","KERNEL32.DLL!InitializeSListHead","KERNEL32.DLL!IsDebuggerPresent","KERNEL32.DLL!IsProcessorFeaturePresent","KERNEL32.DLL!IsValidCodePage","KERNEL32.DLL!IsValidLocale","KERNEL32.DLL!LCMapStringEx","KERNEL32.DLL!LCMapStringW","KERNEL32.DLL!LeaveCriticalSection","KERNEL32.DLL!LoadLibraryExW","KERNEL32.DLL!LocalFree","KERNEL32.DLL!LockFileEx","KERNEL32.DLL!MoveFileExW","KERNEL32.DLL!MultiByteToWideChar","KERNEL32.DLL!OpenProcess","KERNEL32.DLL!OutputDebugStringW","KERNEL32.DLL!QueryFullProcessImageNameW","KERNEL32.DLL!QueryPerformanceCounter","KERNEL32.DLL!RaiseException","KERNEL32.DLL!ReadFile","KERNEL32.DLL!RtlCaptureContext","KERNEL32.DLL!RtlLookupFunctionEntry","KERNEL32.DLL!RtlPcToFileHeader","KERNEL32.DLL!RtlUnwindEx","KERNEL32.DLL!RtlVirtualUnwind","KERNEL32.DLL!SetDefaultDllDirectories","KERNEL32.DLL!SetDllDirectoryW","KERNEL32.DLL!SetEnvironmentVariableW","KERNEL32.DLL!SetEvent","KERNEL32.DLL!SetFilePointerEx","KERNEL32.DLL!SetLastError","KERNEL32.DLL!SetStdHandle","KERNEL32.DLL!SetUnhandledExceptionFilter","KERNEL32.DLL!TerminateProcess","KERNEL32.DLL!UnhandledExceptionFilter","KERNEL32.DLL!UnlockFileEx","KERNEL32.DLL!VirtualProtect","KERNEL32.DLL!WaitForMultipleObjects","KERNEL32.DLL!WaitForSingleObject","KERNEL32.DLL!WideCharToMultiByte","KERNEL32.DLL!WriteConsoleW","KERNEL32.DLL!WriteFile","NCRYPT.DLL!NCryptExportKey","NCRYPT.DLL!NCryptFreeObject","NCRYPT.DLL!NCryptGetProperty","NCRYPT.DLL!NCryptOpenKey","NCRYPT.DLL!NCryptOpenStorageProvider","NCRYPT.DLL!NCryptSignHash","OLE32.DLL!CoCreateGuid","OLE32.DLL!StringFromGUID2","VERSION.DLL!GetFileVersionInfoSizeW","VERSION.DLL!GetFileVersionInfoW","VERSION.DLL!VerQueryValueW","WINTRUST.DLL!WinVerifyTrust"],"kind":"service","nativeInspectionHash":"sha256:e7af8b3e7d03c4c143dac22188e86449f671c9d5fa397a401ce34c7be279b5eb","path":"bin/AegisStellarCustodian.exe","sha256":"sha256:19d031eec8a4e52b20229e2753a3526dbc6d558634f88f3cafc15e5c7b5f51d2","signers":["AUTHENTICODE:UNSIGNED"]},{"authenticodePolicy":"UNSIGNED_REVIEW_ONLY","bytes":682496,"imports":["ADVAPI32.DLL!CloseServiceHandle","ADVAPI32.DLL!ConvertSecurityDescriptorToStringSecurityDescriptorW","ADVAPI32.DLL!ConvertSidToStringSidW","ADVAPI32.DLL!ConvertStringSecurityDescriptorToSecurityDescriptorW","ADVAPI32.DLL!CreateWellKnownSid","ADVAPI32.DLL!EqualSid","ADVAPI32.DLL!GetAce","ADVAPI32.DLL!GetSecurityDescriptorDacl","ADVAPI32.DLL!GetSecurityDescriptorOwner","ADVAPI32.DLL!GetSecurityInfo","ADVAPI32.DLL!GetTokenInformation","ADVAPI32.DLL!ImpersonateNamedPipeClient","ADVAPI32.DLL!IsWellKnownSid","ADVAPI32.DLL!LookupAccountNameW","ADVAPI32.DLL!OpenProcessToken","ADVAPI32.DLL!OpenSCManagerW","ADVAPI32.DLL!OpenServiceW","ADVAPI32.DLL!OpenThreadToken","ADVAPI32.DLL!QueryServiceConfig2W","ADVAPI32.DLL!QueryServiceConfigW","ADVAPI32.DLL!QueryServiceObjectSecurity","ADVAPI32.DLL!QueryServiceStatusEx","ADVAPI32.DLL!RegisterServiceCtrlHandlerExW","ADVAPI32.DLL!RevertToSelf","ADVAPI32.DLL!SetServiceStatus","ADVAPI32.DLL!StartServiceCtrlDispatcherW","BCRYPT.DLL!BCryptCloseAlgorithmProvider","BCRYPT.DLL!BCryptCreateHash","BCRYPT.DLL!BCryptDestroyHash","BCRYPT.DLL!BCryptDestroyKey","BCRYPT.DLL!BCryptFinishHash","BCRYPT.DLL!BCryptGenRandom","BCRYPT.DLL!BCryptGetProperty","BCRYPT.DLL!BCryptHashData","BCRYPT.DLL!BCryptOpenAlgorithmProvider","BCRYPT.DLL!BCryptVerifySignature","CRYPT32.DLL!CertCloseStore","CRYPT32.DLL!CertFindCertificateInStore","CRYPT32.DLL!CertFreeCertificateContext","CRYPT32.DLL!CertGetCertificateContextProperty","CRYPT32.DLL!CryptBinaryToStringA","CRYPT32.DLL!CryptDecodeObjectEx","CRYPT32.DLL!CryptImportPublicKeyInfoEx2","CRYPT32.DLL!CryptMsgClose","CRYPT32.DLL!CryptMsgGetParam","CRYPT32.DLL!CryptQueryObject","KERNEL32.DLL!CancelIoEx","KERNEL32.DLL!CloseHandle","KERNEL32.DLL!CompareStringW","KERNEL32.DLL!ConnectNamedPipe","KERNEL32.DLL!CreateEventW","KERNEL32.DLL!CreateFileW","KERNEL32.DLL!CreateNamedPipeW","KERNEL32.DLL!DecodePointer","KERNEL32.DLL!DeleteCriticalSection","KERNEL32.DLL!DeleteFileW","KERNEL32.DLL!DisconnectNamedPipe","KERNEL32.DLL!EncodePointer","KERNEL32.DLL!EnterCriticalSection","KERNEL32.DLL!EnumSystemLocalesW","KERNEL32.DLL!ExitProcess","KERNEL32.DLL!FindClose","KERNEL32.DLL!FindFirstFileExW","KERNEL32.DLL!FindNextFileW","KERNEL32.DLL!FlsAlloc","KERNEL32.DLL!FlsFree","KERNEL32.DLL!FlsGetValue","KERNEL32.DLL!FlsSetValue","KERNEL32.DLL!FlushFileBuffers","KERNEL32.DLL!FreeEnvironmentStringsW","KERNEL32.DLL!FreeLibrary","KERNEL32.DLL!GetACP","KERNEL32.DLL!GetCPInfo","KERNEL32.DLL!GetCommandLineA","KERNEL32.DLL!GetCommandLineW","KERNEL32.DLL!GetConsoleMode","KERNEL32.DLL!GetConsoleOutputCP","KERNEL32.DLL!GetCurrentProcess","KERNEL32.DLL!GetCurrentProcessId","KERNEL32.DLL!GetCurrentThread","KERNEL32.DLL!GetCurrentThreadId","KERNEL32.DLL!GetEnvironmentStringsW","KERNEL32.DLL!GetFileAttributesW","KERNEL32.DLL!GetFileInformationByHandle","KERNEL32.DLL!GetFileInformationByHandleEx","KERNEL32.DLL!GetFileSizeEx","KERNEL32.DLL!GetFileType","KERNEL32.DLL!GetLastError","KERNEL32.DLL!GetLocaleInfoW","KERNEL32.DLL!GetModuleFileNameW","KERNEL32.DLL!GetModuleHandleExW","KERNEL32.DLL!GetModuleHandleW","KERNEL32.DLL!GetNamedPipeClientProcessId","KERNEL32.DLL!GetNamedPipeServerProcessId","KERNEL32.DLL!GetOEMCP","KERNEL32.DLL!GetOverlappedResult","KERNEL32.DLL!GetProcAddress","KERNEL32.DLL!GetProcessHeap","KERNEL32.DLL!GetProcessTimes","KERNEL32.DLL!GetStartupInfoW","KERNEL32.DLL!GetStdHandle","KERNEL32.DLL!GetStringTypeW","KERNEL32.DLL!GetSystemDirectoryW","KERNEL32.DLL!GetSystemTimeAsFileTime","KERNEL32.DLL!GetSystemTimePreciseAsFileTime","KERNEL32.DLL!GetTickCount","KERNEL32.DLL!GetTickCount64","KERNEL32.DLL!GetUserDefaultLCID","KERNEL32.DLL!GetVolumeInformationW","KERNEL32.DLL!GetVolumePathNameW","KERNEL32.DLL!HeapAlloc","KERNEL32.DLL!HeapFree","KERNEL32.DLL!HeapReAlloc","KERNEL32.DLL!HeapSize","KERNEL32.DLL!InitializeCriticalSectionEx","KERNE